{
  "schema_version": "1.0",
  "product_id": "the-panels-streaming",
  "latest_version": "1.0.0",
  "latest_version_code": 141,
  "min_supported_version": "1.0.0",
  "mandatory": false,
  "release_date": "2026-10-12T00:00:00Z",
  "release_notes": "Official release of The Panels Streaming v1.0.0 with AuthLX licensing, dark theme, and high performance streaming.",
  "download_url": "https://github.com/ThePanelsHub/the-panels-streaming/releases/download/v1.0.0/androidApp-full-debug.apk",
  "apk_sha256": "0f952079cbcc80efdd55c48dbcddcd08711a13d0db70c8657b801ebfc5d5d46e"
}