{
  "schema_version": "1.0",
  "product_id": "panels-play",
  "latest_version": "1.0.0",
  "latest_version_code": 141,
  "min_supported_version": "1.0.0",
  "mandatory": false,
  "release_date": "2026-10-13T00:00:00Z",
  "release_notes": "Official release of Panels Play v1.0.0 with AuthLX licensing, dark theme, and high performance streaming.",
  "download_url": "https://github.com/ThePanelsHub/the-panels-streaming/releases/download/v1.0.0/androidApp-full-debug.apk",
  "apk_sha256": "b935e11946095561dccdd87a6f6596c009f7fdebc32027c6af45ea24d64f47b8"
}
